 As temperaturas tinham subido, e agora sentiam um calor desconfortável, com os homens a ficarem enterrados até aos joelhos enquanto puxavam os barcos através dos afiados pedaços de gelo.|sample-2960.wav
 Desde a guerra, o hasteamento da bandeira do Japão está praticamente limitado a prédios ligados aos governos locais e nacionais, como prefeituras, é raramente vista em residências privadas e estabelecimentos comerciais, mas algumas pessoas e empresas exibem a bandeira em feriados.|sample-2962.wav
 Também pela primeira vez eventos dos Jogos Paralímpicos de Verão foram realizados fora da cidade sede.|sample-2963.wav
O clima japonês apresenta uma clara diferenciação entre as estações e sofre a influência de massas de ar frias vindas da Sibéria no inverno, bem como de massas de ar quentes do Pacífico no verão.|sample-2964.wav
No final, tanto o senado quanto a câmara aprovaram por uma pequena margem a reforma eleitoral – que ficou conhecida como Lei dos Círculos.|sample-2966.wav
 Em outros corpos celestes com crateras, como a Terra e a Lua, as crateras apresentam uma variedade de estados de degradação.|sample-2968.wav
 Ambos os processos foram fechados em dois mil e dezesseis.|sample-2971.wav
 A taxa metabólica basal começa a aumentar a partir do terceiro mês, de modo a responder às necessidades conjuntas da mãe e do feto.|sample-2975.wav
Os críticos mais recentes já não trabalham na linha de uma apologia quase incondicional do Barroco brasileiro como fizeram as primeiras gerações de estudiosos, numa fase em que o estilo surgiu como elemento aglutinador em torno do qual se consolidou uma nova identidade nacional.|sample-2978.wav
 E, quando em risco, ela só pode ser salva por si mesma.|sample-2980.wav
 Disputas sobre o seu uso levaram a protestos, processos e pelo menos um suicídio na prefeitura de Hiroshima.|sample-2983.wav
 O núcleo é envolto por uma camada parcialmente em fusão com um raio de cerca de quinhentos km.|sample-2985.wav
Até então, a grande maioria dos passageiros que tinham conseguido embarcar nos botes eram da primeira e segunda classe.|sample-2996.wav
Algumas propostas, cada uma das quais envolve hipóteses não testadas, são descartadas.|sample-3000.wav
 A origem da sua ascensão não é clara.|sample-3010.wav
 Por meio de um estudo detalhado dos percentis medidos em uma população com idade fixa e por meio de testes estatísticos de adequação, as distribuições dos pesos e das alturas por faixa etária foram modeladas por distribuições de probabilidade.|sample-3013.wav
 Em adultos, devem ainda ser consideradas a doença pulmonar obstrutiva crónica, insuficiência cardíaca congénita, a presença de nódulos nas vias respiratórias ou ainda tosse induzida por fármacos e difunções nas cordas vocais.|sample-3019.wav
 Não desespera, não chora, não exige vingança.|sample-3021.wav
 Alguns desses materiais tinham sido escolhidos por Cecil.|sample-3030.wav
 Para reforçar o casco, foram colocadas mais camadas de madeira.|sample-3032.wav
O interior da Terra, assim como o de outros planetas telúricos, é dividido em camadas definidas com base nas suas propriedades químicas e físicas, mas ao contrário dos outros planetas telúricos tem um núcleo interno e um núcleo externo distintos.|sample-3044.wav
 A integração entre os municípios é firmada por meio de convênios de cooperação, que têm o objetivo de assegurar a manutenção da paz entre os povos, baseada na fraternidade, felicidade, amizade e respeito recíproco entre as nações.|sample-3048.wav
 Das dez nações mais religiosas do mundo, todas têm um PIB per capita inferior a quatorze.|sample-3049.wav
 O catolicismo era a religião oficial do Brasil e existia certo grau de controle do estado herdado do domínio português, incluindo a nomeação de clérigos.|sample-3051.wav
 O governo também indiretamente começou a resolver o problema dos militares recalcitrantes pela revitalização da moribunda Guarda Nacional, até então uma entidade que existiu na maior parte apenas no papel.|sample-3052.wav
 As pradarias lentamente se transformam em um mato alto de cerrado no nordeste do país, com um crescimento mais denso.|sample-3054.wav
 A conquista da Grécia levou para Roma um grande número de escravos extremamente qualificados e instruídos.|sample-3057.wav
 Inglaterra, Escócia, País de Gales e Irlanda do Norte competem como países separados em competições internacionais.|sample-3060.wav
 Como foi demonstrado, toda a produção romana de escultura foi imensamente devedora do exemplo grego, o mesmo se dando com as outras artes, como a poesia, a música e a arquitetura.|sample-3061.wav
Para conseguir dinheiro, Emma decidiu se dedicar a profissão de enfermeira para a qual havia começado a estudar na prisão.|sample-3062.wav
 Alguns estudos recentes têm examinado as condições sociais, entre outras, por trás da produção artística.|sample-3065.wav
 Ele também checa se o site que está sendo visitado está nas listas negras, e avisa se ele se encontra em uma destas listas.|sample-3067.wav
 Acredito que o disco representa este momento na minha vida.|sample-3071.wav
O controlo de um surto exige a coordenação entre vários serviços médicos, a par de um determinado nível de envolvimento da comunidade.|sample-3075.wav
 Depois de uma campanha internacional, ele foi libertado em mil, novecentos e noventa, quando recrudescia a guerra civil em seu país.|sample-3079.wav
 Apenas dois espécimes empalhados existem hoje, um no Museu de História Natural de Paris, e o outro no Museu de Viena.|sample-3080.wav
 Os principais legados seriam o planejamento urbano e social de longo prazo, o crescimento do interesse pelo país e o desenvolvimento do esporte na região.|sample-3086.wav
 Os primeiros sintomas da intoxicação manifestam -se geralmente entre oito e doze horas após a ingestão, sob a forma de desordens gastrointestinais e nervosas e, dependendo da dose, pode levar à morte.|sample-3087.wav
 O problema também pode ser evitado ao recusar passageiros temporariamente, quando estes passam das máquinas de bilhetes para as plataformas.|sample-3088.wav
 Seu objetivo era aleijar as indústrias do principal rival europeu da Alemanha.|sample-3089.wav
 A classificação baseada nas caraterísticas morfológicas, como o tamanho e forma dos esporos ou das estruturas frutíferas, tem dominado tradicionalmente a taxonomia dos fungos.|sample-3095.wav
 As tumbas mais importantes nessa fase estão na região de Tarquinia, Tuscania, Perugia e Sovana.|sample-3098.wav
Os Estados Unidos têm a maior taxa registrada de encarceramento e a maior população carcerária total do mundo.|sample-3101.wav
 A cena mostra a apoteose de Santo Inácio.|sample-3105.wav
 Também foi rápido o desenvolvimento da zona rural.|sample-3109.wav
 Quando eles não me quiseram mais, eu achei que não fosse nada de mais.|sample-3118.wav
Os esforços de modernização não foram suficientes para evitar o declínio do regime imperial.|sample-3133.wav
 Sua cauda é comprida e frágil e se rompe facilmente, assim como a de outros lagartos, já que as caudas podem se regenerar.|sample-3136.wav
 No entanto, análises negativas da produção causaram desconforto novamente.|sample-3137.wav
Esta competição, a segunda edição mundial da carreira da ginasta, decorreu-se na Dinamarca e contou com todos os eventos.|sample-3143.wav
 O Brasil apenas há pouco vem abordando o problema, e o governo reconhece que ele é de grande gravidade, mas ainda está longe de alcançar a desejável eficiência em seu controle.|sample-3147.wav
A cidade do Rio de Janeiro é um dos mais importantes entrepostos rodoviários do Brasil.|sample-3150.wav
 As músicas são terrivelmente mal escritas e sem pegada.|sample-3151.wav
 Neste evento, no qual competiu aos quatorze anos, conquistou duas medalhas, ambas de prata.|sample-3152.wav
O novo processo a que o anúncio se referia era o uso de placas secas de gelatina transparente, utilizadas como camada adesiva para a fixação dos sais de prata sobre o papel.|sample-3153.wav
Assim como a origem do nome do reino, a natureza etnolinguística do povo é objeto de muita discussão entre os especialistas.|sample-3155.wav
 Por vezes estas condições melhoram após remover o glúten da dieta.|sample-3162.wav
 Porém, o autor da infração era ele, após desferir com a sola do pé um chute, pensando ser em Falcão, nos testículos de Batista.|sample-3163.wav
 Os crimes não prescreviam pelo tempo e justificações como embriaguez, descontrole emocional e a coação não costumavam ser aceitas como atenuantes ou escusas de responsabilidade.|sample-3165.wav
 Eles finalmente declararam -nos indesejáveis para permanecer entre os cidadãos e a sociedade alemã, que ao longo do tempo desumanizou o grupo, sem dúvida estas ações eram insensíveis ao povo alemão, visto que  resultaram no Holocausto.|sample-3171.wav
 Estes e outros fatores combinados têm acelerado o declínio contemporâneo da biodiversidade mundial.|sample-3177.wav
 Sendo o porto mais importante de Marrocos, Salé era uma das cidades mais populosas do reino.|sample-3180.wav
 O jacaré impressionou a todos pelo tamanho e beleza.|sample-3183.wav
 E esses investimentos vêm mostrando resultados positivos.|sample-3192.wav
 Por causa das propriedades farmacológicas destas toxinas, algumas espécies são recoletadas.|sample-3194.wav
 A personalidade de Dante foi inspirada no personagem principal da série manga Cobra.|sample-3204.wav
 Atualmente o Sol segue em direção a uma das áreas com menor densidade de nuvem chamada de bolha local e, segundo estimativas, provavelmente a cruzará em toda a sua extensão nos próximos dez mil anos.|sample-3207.wav
 Conhecidos do eletricista revidaram a golpes de chutes e braços e conseguiram conter os seguranças, que foram embora mas prometeram se vingar.|sample-3208.wav
 Existe portanto objeto para pesquisas futuras sobre o cultivo de estirpes mais seguras.|sample-3212.wav
A série do jogo se foca em eventos históricos pelo tempo.|sample-3214.wav
As construções londrinas são muito diversificadas e são caracterizadas por vários estilos arquitetônicos diferentes, em parte por causa da idade das edificações.|sample-3219.wav
 O processo de endurecimento das paredes arteriais com o envelhecimento é progressivo e o aumento de pressão arterial sistólica com a idade também será progressivo sem que isto signifique hipertensão arterial.|sample-3220.wav
 Imitava-se, desta forma, em ambiente urbano, o antigo coronelismo agrário.|sample-3223.wav
 Esse mesmo nome também é utilizado em franquias esportivas, como no time nacional de futebol.|sample-3227.wav
 A evolução geológica provocou o surgimento de grandes dunas e tabuleiros no litoral da região.|sample-3230.wav
 O bico era curvo, forte, negro e com ranhuras na superfície.|sample-3232.wav
 Seus objetivos eram unificar os homossexuais e educá- los, além de liderar e auxiliar os chamados desviantes sexuais com problemas legais.|sample-3236.wav
 Seu mandato de governador seria de cinco anos e, com o cargo, teria imunidade processual.|sample-3237.wav
 As tabernas, bares, estalagens e termopólios vendiam refeições prontas, embora comer nesses locais ou levar comida para casa fosse comum apenas entre as classes mais baixas.|sample-3238.wav
 O Canadá também se envolveu com a Rússia em uma polêmica que envolveu o julgamento da competição de duplas da patinação artística.|sample-3242.wav
 As vítimas foram executadas na floresta na Rússia.|sample-3243.wav
 Concedeu uma única entrevista sobre o caso, para a revista Crescer, em dezembro de dois mil e dois.|sample-3250.wav
 Ainda naquele ano, sua esposa, Cornélia, morreu.|sample-3252.wav
Inocêncio também convocou o mais importante concílio da Idade Média, o Quarto Concílio de Latrão, que destaca-se por ter definido o papel da Eucaristia na Igreja por meio da declaração do dogma da transubstanciação, da doutrina que “fora da Igreja não há salvação”, da obrigatoriedade da confissão anual e de novas leis sobre a consanguinidade e o casamento.|sample-3257.wav
 O segundo país foi a Austrália, exibida no dia treze de fevereiro.|sample-3258.wav
A forte ligação com o Império Britânico e com a Comunidade das Nações levou a uma participação importante nos esforços militares britânicos na Segunda Guerra, na Primeira Guerra Mundial e na Segunda Guerra Mundial.|sample-3260.wav
 A cidade possui os mais diversos credos protestantes ou reformados, como por exemplo a Assembleia de Deus.|sample-3262.wav
 Raramente há roxo, laranja, amarelo, marrom ou azul.|sample-3263.wav
 É na realidade uma vista geral de toda a escola, de forma uniforme, onde um grupo de jurados avalia por alto toda a interação entre os vários quesitos.|sample-3266.wav
 Por outro lado por ser um alimento altamente energético, o consumo excessivo aumenta o risco de obesidade.|sample-3273.wav
 As suas preferências pela arte e arquitetura romanas refletiram -se claramente no desenho da cidade.|sample-3275.wav
Embora o tamanho e a forma do bico das aves varie significativamente de espécie para espécie, a sua estrutura é idêntica.|sample-3276.wav
 Outro rascunho incluía o onipotente personagem, interpretado por John.|sample-3277.wav
A extensa hidrovia presente no Camboja é facilmente navegável.|sample-3278.wav
O instituto também citou expectativas para a economia em dois mil e doze, onde possivelmente, crescerá entre cinco porcento e cinco ponto cinco pocento, ainda acima da média nacional.|sample-3283.wav
A Alemanha e os Estados Unidos são aliados próximos.|sample-3286.wav
 Atualmente, ainda ocorre no Texas, desde o México e América Central até ao norte da Argentina, apesar de não mais ocorrer na província de Entre Ríos.|sample-3287.wav
 O projeto foi interrompido quando faltavam quatrocentos metros para a sua finalização e optou-se por deixá- lo para ser usado como estaleiro.|sample-3288.wav
 Ursos polares também predavam suas colônias de nidificação.|sample-3289.wav
Foi neste período que a assim chamada segunda geração da RAF começou a emergir, depois da reorganização da facção feita pelo advogado e simpatizante, entre os sobreviventes em liberdade com integrantes de outros grupos simpatizantes da RAF.|sample-3292.wav
Otaviano os perseguiu e derrotou na Batalha de Alexandria em um de agosto de trinta.|sample-3293.wav
 A criação da comarca aconteceu em vinte e três de março de mil, oitocentos e cinquenta e três.|sample-3294.wav
 Todas, exceto uma, trazem os movimentos numa mesma tonalidade, um padrão comum para suítes mas não para concertos.|sample-3295.wav
 Depois de uma batalha desesperadora, ele estava preso após se recusar a se render.|sample-3298.wav
 No jogo inaugural, derrotou o Flamengo por um a zero, com gol de Mini.|sample-3299.wav
 Na alta troposfera, o ar seco e frio tende a sair do centro do sistema, causado pelo estabelecimento de uma força de gradiente de pressão com sentido radial inverso ao observado na superfície e sensivelmente mais fraca.|sample-3300.wav
 Depois de um período de declínio, a cidade foi ultrapassada por Fez, mas no princípio do século quinze tornou-se novamente a capital de Marrocos.|sample-3301.wav
 O Programa das Nações Unidas para o Desenvolvimento, por exemplo, quantificou os serviços ambientais providos pelos oceanos, calculando seu valor em vinte e um trilhões de dólares anuais, ao passo que os benefícios diretos tirados do mar, como a pesca e o turismo, ficam em três trilhões.|sample-3302.wav
As canções do Nirvana receberam em sua maioria, aclamação da crítica e tiveram um bom desempenho nas paradas pelo mundo.|sample-3303.wav
 O efeito da envelhecimento sobre o câncer é complexo, com uma série de fatores, tais como danos no DNA.|sample-3305.wav
 Padrões de apego inseguro são não ideais pois eles podem comprometer a exploração, a auto- confiança e o conhecimento mais profundo do ambiente.|sample-3308.wav
Belo Horizonte é nacionalmente conhecida como a capital nacional dos botecos.|sample-3309.wav
 Houve um tumulto contínuo dentro de sua equipe e fez várias mudanças de funcionários de alto nível.|sample-3310.wav
 Além dos riscos inerentes à prática de equitação, o uso de armas, o arrebatamento, a excitação e a falta de habilidade fazem os cavaleiros incorrer em perigos que podem originar acidentes que por vezes são fatais.|sample-3311.wav
Os seguintes países possuem reivindicações territoriais na Antártica.|sample-3316.wav
 Isso é demonstrado por uma série de evidências físicas e por reconstruções teóricas.|sample-3319.wav
 O índice de alfabetização da população quinze ou mais de idade, em dois mil e dez, era de noventa e oito ponto nove porcento.|sample-3320.wav
 Tinha também um músculo fraco nas costas, por isso tinha de receber massagens duas vezes por semana.|sample-3323.wav
 Estas descobertas permitiram sustentar a evidência de um comportamento social no Albertossauro ainda que alguns ou todos os lugares mencionados possam representar agregações temporais ou não-naturais.|sample-3324.wav
No trigésimo ano da vida de Beda, foi ordenado padre pelo bispo João.|sample-3327.wav
 Porém, diante da situação crítica no Oriente, onde os persas invadiram muitos territórios e estavam atacando a Anatólia, foi feito comandante do exército armênio no outono de seiscentos e onze.|sample-3328.wav
 Apesar da pressão da Liga e de vários ministérios do governo, a maioria dos professores universitários não fizeram alterações em suas palestras ou programas de ensino durante o período nazista.|sample-3331.wav
 e o dinheiro anda mais curto do que perna de cobra.|sample-3333.wav
 Ciclones tropicais causam danos significativos a infraestruturas, levando a interrupção do fornecimento de eletricidade e água potável, destruição de pontes e corredores de acesso, que dificultam os esforços de reconstrução.|sample-3337.wav
 A localização das áreas de parturição de inverno são ainda desconhecidas, já que essas baleias tendem a migrar ao oceano aberto, cujas exatas localizações têm sido difíceis de determinar.|sample-3340.wav
 A igreja contém importantes esculturas, pinturas e peças de altar dos séculos dezesseis, dezessete e dezoito, com destaque para um magnífico retábulo barroco em talha dourada do século dezessete, onde se encontra uma imagem de Nossa Senhora das Virtudes e do Bom Sucesso.|sample-3341.wav
 Sendo a filha rebelde e pouco convencional de uma das famílias mais ricas da cidade, ela foi muito mencionada nos jornais da capital dos Estados Unidos.|sample-3342.wav
Consideram -se ótimas as condições de saúde do estado, o que torna elevado o nível de economia da população.|sample-3344.wav
 Locais e edifícios das proximidades, em volta da área comercial, como a mesquita, palácio, hospital, parada e jardins, foram reconstruídos e a casbá foi fortificada.|sample-3347.wav
 O vendedor disse que o objeto havia sido encontrado junto a moedas do tempo da dinastia júlio claudiana.|sample-3349.wav
 O concerto acabou rápido quando a reunião foi invadida por um time da SWAT  e os espectadores foram evacuados para fora do prédio.|sample-3351.wav
 Durante essas noites, a taxa horária varia entre cinquenta e oitenta meteoros.|sample-3352.wav
 Em termos físicos, a probabilidade ganha um sentido mais concreto.|sample-3353.wav
 Ciclones tropicais particularmente intensos podem exibir olhos com diâmetro muito pequeno em comparação com o restante da tempestade.|sample-3359.wav
 No ano de dois mil e seis a taxa de homicídios no município foi de dez ponto um porcento para cada habitante.|sample-3363.wav
 Crítias via a religião como uma invenção humana usada para assustar as pessoas e fazê- las seguir a ordem moral.|sample-3365.wav
 Algumas cidades afirmavam -se como grandes centros regionais de determinada indústria ou atividade comercial e a escala das edificações em áreas urbanas indica uma indústria de construção plena desenvolvida.|sample-3367.wav
 Ele declarou, num artigo que apresentou no Congresso Mundial do Espaço, Foi praticamente impossível criar um controle de temperatura confiável em tão pouco tempo.|sample-3368.wav
 Como um membro do Conselho de Governadores da Agência Internacional de Energia Atômica, o país tem sido uma voz forte em apoio aos esforços de não-proliferação nuclear e é altamente comprometido com a segurança nuclear global.|sample-3369.wav
 Esta é a minha chance de criar algo que não é apenas suporte da minha convicção política e social, não apenas para a comunidade homossexual, mas para todos.|sample-3370.wav
 Não parece ter sido um grande leitor, mas conhecia em alguma medida varios autores famosos, além de provavelmente ter lido obras sobre história, educação e política, mas muitas dessas leituras aparentemente foram feitas tendo em vista mormente a elaboração de textos para óperas ou canções.|sample-3373.wav
 Devido à redução das florestas, as populações ficaram mais fragmentadas, o que conduz à perda da diversidade genética no potencial grupo de reprodutores.|sample-3374.wav
 A reconstrução levou mais de dez anos e foi supervisionado por Roberto.|sample-3375.wav
 O tamanho médio das salas de aula aumentou de trinta e sete em mil, novecentos e vinte e sete para quarenta e três em mil, novecentos e trinta e oito, devido à falta de professores.|sample-3378.wav
 O Brasil também tem uma grande variedade de doces, como o brigadeiro, o beijinho e o bolo de rolo.|sample-3381.wav
 Assim, foi dada uma especial atenção ao isolamento da zona de quartos.|sample-3382.wav
 Por volta de mil, quinhentos e quarenta e sete, mapas europeus passaram a nomear esta região, acrescida das áreas que a cercavam, pelo nome de Canada.|sample-3383.wav
 Na Índia, o álbum foi certificado como ouro em sua primeira semana de lançamento e se tornou o álbum internacional com vendas mais rápidas do ano.|sample-3386.wav
O processo do desenvolvimento da doutrina, que necessita de ser sempre contínuo e fiel à Tradição, implica a definição gradual de dogmas, que, uma vez proclamados solenemente, são imutáveis e eternos.|sample-3387.wav
 A partir deste momento Urubu, o nome adotado pela vila, foi emancipado de Jacobina e tomou maior independência administrativa.|sample-3388.wav
O país ocupa uma vasta área ao longo da costa leste da América do Sul e inclui grande parte do interior do continente, compartilhando fronteiras terrestres com Uruguai ao sul ; Argentina e Paraguai a sudoeste, Bolívia e Peru a oeste; Colômbia a noroeste e Venezuela, Suriname, Guyana e com o departamento ultramarino francês da Guyana Francesa ao norte.|sample-3389.wav
 Contudo, a empresa não colocou o gelado no mercado nem revelou os ingredientes do mesmo até ao fim da transmissão do episódio.|sample-3390.wav
Os dados do ministério também apontaram que a hospitalidade e a gastronomia foram os itens mais bem avaliados pelos visitantes estrangeiros, com noventa e oito porcento e noventa e três porcento de aprovação, respectivamente.|sample-3393.wav
 O terceiro episódio marcou a pior audiência do seriado até o momento.|sample-3398.wav
A energia solar também pode ser utilizada num tanque para o tratamento de águas residuais, sem o uso de produtos químicos ou de eletricidade.|sample-3402.wav
 Cada uma das irmãs tem um poder particular, que se desenvolve à medida que conseguem controlá- lo.|sample-3403.wav
 Os principais municípios limítrofes são Sondica, Basauri, Zamudio e Baracaldo.|sample-3405.wav
 Durante estes anos, em todos os verões, Arcádio ausentou-se da capital rumo a Ancira.|sample-3409.wav
 A Secretaria de Esportes e Lazer também é responsável por outras áreas da cultura vila- velhense, tais como atividades de lazer e práticas desportivas.|sample-3410.wav
 Suas competições possuem cinco divisões par feminino, par masculino, par misto, trio feminino e quarteto masculino.|sample-3412.wav
 A presença da corte mudou esta situação radicalmente e de improviso, atraindo todas as atenções e passando a ser o centro de irradiação de estéticas novas, nomeadamente o Neoclassicismo, já favorecido na metrópole lusitana, com o consequente abandono da tradição barroca e rococó, que até então continuava a exercer grande influência em toda a colônia brasileira.|sample-3419.wav
 Seus três elementos musicais eram acústico representando o passado, eletrônicos representando o futuro e o presente sendo uma mistura dos dois anteriores em estilo e instrumentalização.|sample-3430.wav
 Um exemplo de conhecimento de terceiro tipo é o conhecimento que a mente tem de si mesma a partir do conhecimento que tem de Deus.|sample-3434.wav
 A sua captura iria trazer ao regime de Lecapenos um enorme aumento de popularidade e legitimidade.|sample-3438.wav
Antigamente, a espécie era encontrada em uma variedade imensa de habitats, como lagos, lagoas, córregos, pântanos, valas em estradas e planícies aluviais.|sample-3439.wav
 Começam -se a formar os folículos pilosos e os mamilos, são visíveis os cotovelos e os dedos dos pés e o ducto vitelino é geralmente encerrado.|sample-3440.wav
A longa e árdua estrada entre Pelotas e Porto Alegre mais as dificuldades que enfrentou na presiganga tiveram um enorme impacto na sua saúde ele sofreu de reumatismo e artrite pelo resto da vida.|sample-3445.wav
 A importância dos ventos alísios para a navegação em ambos os hemisférios era já conhecida pelos navegadores portugueses do século dezesseis.|sample-3446.wav
 Quando os anéis não estão visíveis, outras luas também são mais facilmente localizadas.|sample-3447.wav
