 Nesse mesmo ano, cento e oitenta e sete hectares eram cobertos por cursos hídricos e setecentos e quarenta e dois hectares eram áreas urbanizadas.|sample-1102.wav
A czarina Catarina, a Grande continuou o trabalho de Pedro, derrotando a Polônia e anexando a Bielorrússia e a Ucrânia, outrora a nação fundadora daquele Império.|sample-1103.wav
Para auxiliar a decisão sobre a melhor forma de tratamento, os tumores também são divididos em três categorias genéricas com base na possibilidade aparente da remoção cirúrgica.|sample-1104.wav
 De forma geral seus artistas acreditavam que a natureza era a inefável manifestação de Deus, embora os pintores variassem na profundidade de suas convicções religiosas.|sample-1105.wav
 Além disso, parte do gado que passava pelo local era comercializado em Goiás e Mato Grosso.|sample-1106.wav
 Ele indicou que estava com cinquenta e nove anos de idade na época, o que implica que teria nascido por volta de seiscentos e setenta e dois ou seiscentos e setenta e três.|sample-1109.wav
 O supervisor de efeitos visuais John insistiu que a batalha espacial  possuísse novas configurações de naves da Frota Estelar.|sample-1110.wav
 Estes encontros acabaram quando Charles se juntou às forças britânicas em Espanha.|sample-1112.wav
 No entanto, em certo momento os músicos já sabiam, exceto o produtor David, o qual pensava que o cantor estava com câncer.|sample-1117.wav
O fungo foi descrito pela primeira vez pelo micologista Christian, como Helvella esculenta, e recebeu o seu nome binomial atual quando o micologista sueco Elias o colocou no género Gyromitra em mil, oitocentos e quarenta e nove.|sample-1118.wav
 Seu casco foi aberto cinco metros abaixo da protuberância anti -torpedos por um buraco de aproximadamente vinte e cinco metros, com uma junta falhando entre os cinturões superior e inferior de blindagem, inundando uma das reservas de munições da torre de artilharia traseira.|sample-1119.wav
Outros modos de transmissão incluem o transplante de órgãos, amamentação e por exposição laboratorial acidental.|sample-1120.wav
Pedro tinha cinco anos de idade quando ascendeu ao trono.|sample-1121.wav
 As fêmeas do género, preferem alimentar-se ao longo da noite, iniciando a procura de uma refeição com o pôr do sol.|sample-1122.wav
 Foi construído para a família Chávarri pelo arquiteto Atanasio, segundo um projeto do arquiteto belga Paul.|sample-1123.wav
 Ao finalizar o processo de edição o diretor enviou a Lucas a montagem final para sua revisão.|sample-1126.wav
 No ano de mil, novecentos e noventa e seis prosseguiu dourado para os millonarios, que encerraram uma série de campanhas ruins no campeonato argentino, faturando no segundo semestre o Apertura com nove pontos de vantagem sobre o segundo colocado após terem ficado apenas em decimo quarto  na Clausura, no primeiro semestre.|sample-1127.wav
 Estas espécies danosas são removidas por antioxidantes, como a glutationa, e enzimas, como a catalase e outras peroxidases.|sample-1128.wav
No entanto, toda essa atividade não pagava seu sustento, e ele precisou fazer serviços diversos para sobreviver, principalmente de paisagismo, para o qual tinha um talento reconhecido.|sample-1130.wav
 Ele é também conhecido por ter raptado a deusa filha de Deméter, a quem teria sido fiel e com quem nunca teve filhos.|sample-1132.wav
 Vê- la atuar fez- me pensar, Uau, também há espaço para cantoras- compositoras nesse mundo.|sample-1133.wav
 A combinação destes movimentos produz uma velocidade espacial de vinte quilómetros por hora em relação ao Sol.|sample-1134.wav
 A decisão de terceirizar a conversão foi feita porque a equipe desejava uma versão para computadores de qualidade, porém não tinham meios de lidar com o desenvolvimento de três versões diferentes.|sample-1136.wav
 Os governos britânico e irlandês cooperam em questões não descentralizadas que afetam a Irlanda do Norte por meio da Conferência Intergovernamental Britânica Irlandesa, que assume as responsabilidades do governo da Irlanda do Norte caso este não atue.|sample-1137.wav
 Vários roteiristas tentaram criar uma história que fosse apropriadamente épica, porém todas as tentativas não satisfizeram a Paramount, que decidiu abandonar o projeto em mil, novecentos e setenta e sete.|sample-1139.wav
 A pedido de Letícia, o cassino de Alex é incendiado.|sample-1140.wav
 Tanto o governo central de Ancara, quer diretamente, quer através do kaymakam, como o governo provincial de Antália têm grande influência no distrito.|sample-1141.wav
 Segundo uma carta régia datada de dezessete de dezembro de mil, quinhentos e nove, Cabral tornou-se parte envolvida numa disputa por uma transação de terras envolvendo parte da propriedade que lhe pertencia.|sample-1142.wav
 Entretanto, desde o tempo em que viveu e ao longo dos séculos Camões foi louvado por diversos luminares não- lusófonos da cultura ocidental.|sample-1143.wav
 As Primaveras, dividido em cinco partes, reforça o sentimentalismo exacerbado, a idealização da figura feminina, o egocentrismo e os devaneios juvenis, características fundamentadas pela escola ultrarromântica e pelo herói, personagem estilizado pelo escritor e barão Lord.|sample-1144.wav
 Quando a igreja foi destruída na segunda Guerra Mundial, foram transferidos para uma tumba na Igreja.|sample-1145.wav
 Em dois mil e doze passou de um milhão de passageiros.|sample-1146.wav
 Aqueles que vocês amaram terão sempre o respeito e a gratidão deste país.|sample-1147.wav
 Em meio a escravos se rebelando e fazendo revoluções almejando o fim da escravidão pelo Brasil, acabou se criando em Goiana um clube abolicionista chamado O Terpsícore, que buscava levantar fundos para a libertação dos escravos.|sample-1149.wav
 Um a dois em cada cem casos de cancro do pâncreas são tumores neuroendócrinos que se formam a partir das células do pâncreas produtoras de hormonas.|sample-1150.wav
As noites paratinguenses são marcadas por seus bares, praças e espaços de lazer.|sample-1151.wav
 A sétima canção, é considerada a mais otimista do álbum.|sample-1153.wav
 A Austrália tem uma balança de pagamentos que é mais de sete porcento negativa e teve déficits persistentemente elevados em conta corrente por mais de cinquenta anos.|sample-1155.wav
 Ao mesmo tempo, uma nova doença, divulgada preconceituosamente pelos tabloides como peste gay, começava a se espalhar.|sample-1156.wav
Por vezes, certas pessoas santas, por as suas virtudes, ensinamentos e santidade serem do conhecimento público, são beatificadas ou canonizadas pela Igreja.|sample-1157.wav
 O lugar se localiza próximo da cratera.|sample-1158.wav
Em sua última participação em campeonatos mundiais, agora aos dezoito anos, ele disputou, no Japão, quatro finais.|sample-1161.wav
 As cantoras  também já trabalharam nesse projeto.|sample-1162.wav
Alguns tipos de câncer de crescimento lento são particularmente comuns.|sample-1163.wav
 Atualmente, os números indicam uma tendência decrescente na Europa e na Ásia devido ao uso de pesticidas e à intensificação da agricultura, que reduzem a quantidade de insetos de que se alimenta.|sample-1164.wav
quando o número de pontos tende ao infinito.|sample-1169.wav
 Mas, da mesma forma que na outra ocasião, a viagem o fez gastar muito mais do que recebia.|sample-1170.wav
 A artilharia francesa disparou contra eles, e o gelo quebrou-se debaixo dos seus pés.|sample-1173.wav
 Os momentos centrais da distribuição normal são dados por eles.|sample-1174.wav
 Grande parte do progresso, especialmente na educação superior e na pesquisa científica, foi atribuído a várias instituições públicas.|sample-1175.wav
 Dois documentários foram produzidos nessa ocasião.|sample-1178.wav
Eles continuam envolvidos com bruxaria sobretudo por conta da experiência de seus rituais, alegando que Eu amo mitos, sonhos, a arte visionária.|sample-1179.wav
Pode ser definido como contendo qualquer número.|sample-1180.wav
 Então é cantado o alusivo e em seguida dado o grito de guerra, após o qual o desfile propriamente dito tem início, e o cronômetro começa a correr.|sample-1182.wav
Atribuindo a trovoada à colisão entre nuvens e o raio ao incêndio de uma exalação ejetada pelas nuvens.|sample-1184.wav
 Mesmo assim, o maior problema político enfrentado por Macdonald era o Tratado de Washington, que ainda não tinha sido debatido no parlamento.|sample-1185.wav
O Botafogo é um dos clubes mais tradicionais do país na natação.|sample-1190.wav
A tocha encerrou sua jornada na Cerimônia de Abertura dos Jogos, quando foi usada por quatro atletas canadenses para acender a pira olímpica.|sample-1191.wav
 As coleções de contos folclóricos publicadas pelos Irmãos Grimm popularizaram mundialmente o folclore alemão.|sample-1192.wav
 O país tem uma das taxas mais baixas de crescimento populacional da América Latina, cerca de um porcento ao ano, bem como uma taxa de mortalidade infantil relativamente baixa.|sample-1194.wav
 O centro de Caratinga é um dos principais núcleos comerciais da cidade, sendo considerável a presença de micro e pequenas empresas com sede no próprio município e que contam com uma boa estrutura física.|sample-1195.wav
 Sua cabeça tinha um característico penacho longo e arredondado, com uma textura  peluda.|sample-1196.wav
 Como a língua islandesa e a norueguesa nos tempos medievais eram a mesma, as obras produzidas no país são incluídas na literatura medieval da Escandinávia.|sample-1199.wav
 Eu amo ter essas múltiplas conexões e associações culturais.|sample-1202.wav
 No entanto, o método mais preciso para determinar a idade gestacional é através de ecografia durante o primeiro trimestre de gravidez, o qual tem um intervalo de precisão de sete dias.|sample-1203.wav
Além da religião ter sido praticada através de festivais, nela se acreditava que os deuses interferiam diretamente nos assuntos humanos e que era necessário acalmá- los por meio de sacrifícios.|sample-1205.wav
 No dia seguinte, abateu mais um R cinco e dois MiG um.|sample-1206.wav
 Depois da sua vitória, o elefante ajoelhou-se diante de Tito, o que pôde ter sido parte do próprio treino do animal, mas Marcial atribuiu o fato a um reconhecimento espontâneo do poder do Imperador.|sample-1207.wav
 Começou a disputar por essa época, de maneira despretensiosa, a prova que havia consagrado o bicampeão olímpico e, na virada do século, já tinha alguns resultados expressivos.|sample-1208.wav
 O Espírito Santo, que é o mestre da oração, foi enviado por Jesus para guiar, edificar, animar e santificar a Igreja e para que ela sempre testemunhe e interprete bem a Revelação divina.|sample-1210.wav
 Mas o maior poeta do barroco brasileiro é Gregório de Matos, de grande veia satírica, e igualmente penetrante na religião, na filosofia e no amor, muitas vezes de crua carga erótica.|sample-1211.wav
 Foi necessária uma conversa com o treinador George para que a situação fosse resolvida.|sample-1212.wav
 O malfadado levante dos boxers de mil, oitocentos e noventa e oito a mil, novecentos e um, cujo principal alvo eram os ocidentais em Pequim, resultou em cerca de cento e quinze mil mortes.|sample-1213.wav
 Esta aproximação explora o fato de que nessas bandas é possível distinguir a reflectividade da vegetação da sua fluorescência, que é muito mais fraca.|sample-1214.wav
 No ano de dois mil e dez havia mil e setenta emigrantes que vieram de outras partes do estado de São Paulo e do Brasil, de acordo com o IBGE.|sample-1215.wav
Nos anos dois mil, o país não contou com equipes competitivas ao pódio mundial.|sample-1217.wav
 Inicialmente, no entanto, o patriarcado de Lisboa mostrou-se cauteloso na apreciação dos eventos, e não autorizou de imediato a organização de um centro de culto.|sample-1218.wav
 Outra hipótese sugere que a simplificação tenha ocorrido a partir de conjuntos de peças importadas para a Alemanha provenientes da Índia.|sample-1219.wav
 Isolou o monóxido de carbono, mas aparentemente não percebeu que se tratava de um ar distinto.|sample-1221.wav
 Na verdade, o termo foi concebido como uma extensão de seu argumentos dos replicadores, mas ganhou vida própria nas mãos de outros autores, como Daniel e Susan.|sample-1222.wav
 Com a exceção de dois dias, toda produção foi realizada dentro dos estúdios da Paramount com Charles como diretor de fotografia.|sample-1223.wav
Uma característica típica da superfície do planeta são as numerosas dobras de compressão, ou rupes, que cruzam as planícies.|sample-1224.wav
 No México, por exemplo, os ovos de tartaruga são um prato comum, e os habitantes da região afirmam que os ovos são um afrodisíaco.|sample-1225.wav
O livro foi lançado em dez de julho de dois mil e sete, junto com uma edição de capa dura que chegou às prateleiras estadunidenses pela editora.|sample-1227.wav
 Uma estátua de Hermes guardava a entrada do templo de Apolo em Tebas, e havia algumas em Tânagra em que ele aparecia carregando um cordeiro, pois uma lenda dizia que ele afastara a peste da cidade carregando um cordeiro em torno dos muros.|sample-1229.wav
 Numa festa realizada em Londres, Carlota conheceu o tenente general da cavalaria russa, o príncipe Leopoldo.|sample-1230.wav
Durante a noite entre cinco e seis de agosto, alertas de radares japoneses detectaram a aproximação de inúmeros aviões norte-americanos se dirigindo para o sul do Japão.|sample-1231.wav
 As reuniões dos músicos sobreviventes foram organizadas em mil, novecentos e sessenta e quatro e mil, novecentos e noventa e dois para comemorarem o evento.|sample-1233.wav
 O principal deles, sem dúvida, foram as obras de prolongamento da linha tronco da Cia.|sample-1234.wav
Apesar de o shopping ter sido anunciado em dois mil e dez pelo grupo, várias datas foram determinadas para o início da obra, porém, em nenhuma o empreendimento foi tirado do papel.|sample-1235.wav
Onde você mora?|sample-1236.wav
 Sua música sacra deste período é muito mais majestosa e tranquila do que a de seus anos anteriores, e um distanciamento semelhante da agitação emocional é nítido nos seus últimos madrigais e canções.|sample-1237.wav
 Blumenau decidiu atrair italianos para a sua colônia.|sample-1238.wav
Em mil, novecentos e quarenta e sete, em decorrência de diversos fatores, o museu retornaria ao antigo edifício na Avenida Tiradentes.|sample-1241.wav
 Como militar de carreira, era da opinião que o mosteiro não tinha sido feito para ser uma praça forte, ao contrário do que pensavam os monges.|sample-1242.wav
 O Condado de Orange foi também atingido por ondas variando de um ponto oito  a  três ponto sete metros.|sample-1244.wav
É linha de frente da escola, primeiro grupo de componentes a desfilar, sendo isto uma condição obrigatória.|sample-1245.wav
 Nessa área o ar desce e volta ao equador abaixo das nuvens.|sample-1247.wav
O setor secundário ou industrial é aquele que gera mais emprego estável na cidade, contando esta com três parques industriais e um quarto em construção.|sample-1248.wav
A origem dos mitos da Grécia não deriva puramente da civilização grega, mas da mistura entre a cultura dos indo-europeus, pré gregos, e até mesmo dos asiáticos, egípcios e outros povos com as quais os gregos estabeleceram contato.|sample-1250.wav
A África subsariana continua sendo, majoritariamente, a região mais afetada pela doença.|sample-1251.wav
 Sua produtividade nas ocupações que elas estavam contratadas foram provavelmente afetadas pelos baixos níveis educacionais.|sample-1252.wav
 Em Outubro de dois mil e cinco o grupo lançou um álbum de compilação intitulado um.|sample-1253.wav
Conscientes dos problemas encontrados durante os testes de voo, a McDonnell reviu o programa e propôs um novo desenvolvimento baseado numa aeronave com um design mais convencional, capaz de voar a uma velocidade de zero ponto nove Mach, com asas em delta a trinta e cinco graus.|sample-1255.wav
 A taxa de escolarização na faixa etária de seis a quatorze anos é noventa e nove porcento, tornando o estado líder nesse quesito.|sample-1256.wav
 A peça, situada na Dinamarca, reconta a história de como o Príncipe Hamlet tenta vingar a morte de seu pai, Hamlet, o rei, executado por Cláudio, seu irmão que o envenenou e em seguida tomou o trono casando-se com a rainha.|sample-1258.wav
 Este esquema de interdependência se irradia em todas as direções.|sample-1259.wav
 Acima da prática do exercício físico, para eles o esporte desenvolve a disciplina, a formação do caráter e incentiva o espírito esportivo.|sample-1260.wav
 As nuvens visíveis, localizadas onde a pressão atmosférica varia entre zero ponto sete a um bar, são feitas de gelo de amônia.|sample-1261.wav
 Estes valores estão muito próximos da medida correta de sessenta e trinta, respetivamente.|sample-1262.wav
 Pelo contrário, no sarcófago, os barcos não incluem qualquer um desses elementos, mas apenas um casco.|sample-1264.wav
 O movimento chegou ao poder sem grandes confrontamentos quando tensões durante a derrota da Rússia na guerra contra o Japão levaram a uma greve geral na Finlândia e a revolta revolucionária no império, em mil, novecentos e cinco.|sample-1265.wav
"A origem do termo ""Paralimpíada"" é obscura."|sample-1266.wav
 O modo multijogador foi inspirado pelos combates da campanha um jogador, os desenvolvedores desejavam recriar o ritmo lento dos encontros e manter um sistema de criação similar.|sample-1267.wav
 O Teatro Municipal de Bauru é importante tanto na cidade e no estado e sempre traz muitas atrações e peças renomadas o ano todo e para todos os gostos.|sample-1268.wav
 É uma das lutas com mais contato físico existente, apresentando eminente agressividade.|sample-1270.wav
Estivemos na comissão contra tortura da ONU em Genebra.|sample-1271.wav
 O conselho se reúne cerca de quatro a cinco vezes por ano, quando realiza decisões administrativas de alto nível, como a aprovação do orçamento, e tem a palavra final em processos administrativos internos.|sample-1272.wav
 Uma placa junto ao portão proclama-a uma Heroina da Comuna.|sample-1273.wav
Seu ânimo aumentou, e Nixon buscou um segundo mandato, mas alguns assessores queriam substitui - lo.|sample-1275.wav
 A anatomia do corpo humano torna-se mais transcendente até mesmo nos seus trabalhos da maturidade.|sample-1277.wav
 Na época, o filme foi a terceira maior bilheteria na América do Norte, atrás de Titanic e Star Wars, e o segundo filme de maior bilheteria em todo o mundo atrás de Titanic, sem ajuste na inflação dos preços dos bilhetes.|sample-1278.wav
 Embora a teoria tenha sido rapidamente apoiada pelos ambientalistas, encontrou muita resistência no meio acadêmico, mas muitos de seus pressupostos foram provados e hoje são aceitos pela ciência.|sample-1279.wav
 Nestes primeiros dias do novo regime, Lenin evitou falar em termos marxistas e socialistas para não alienar a população russa, e em vez disso falou sobre ter um país controlado pelos trabalhadores.|sample-1280.wav
 Em laboratórios de investigação podem ser utilizados outros métodos, como a microscopia electrónica.|sample-1281.wav
 Isto porque, afinal, o último papa a chamar-se João fora um francês, ainda na Idade Média, e ainda porque existiu, também na Idade Média, um antipapa com o nome João.|sample-1282.wav
Sua datação e identificação de autoria são invariavelmente dificílimas, senão impossíveis na maior parte dos casos.|sample-1283.wav
 No entanto, as fontes primárias para o trabalho de Mâneton eram as listas crônicas de reis de dinastias egípcias anteriores.|sample-1285.wav
 Os quatro primeiros mandamentos exigem respeito pelo nome de Deus, guarda do Dia do Senhor, reconhecimento e adoração única e proibição do culto a outros deuses.|sample-1286.wav
 É considerado o maior arquiteto português do século dezesseis e um dos grandes da Europa do renascimento.|sample-1287.wav
 Em uma imagem, a quantidade de vezes que uma determinada cor se repete pode ser representada por um histograma.|sample-1290.wav
 Ainda no embalo dessa inovação musical, lançaram o álbum Melon, uma coletânea remix lançado exclusivamente ao fã clube.|sample-1291.wav
 Os Estados Unidos e a Rússia não reconhecem nenhuma reivindicação territorial na Antártica, reservando-se o direito de fazer suas próprias reivindicações.|sample-1292.wav
 A capa do álbum e as fotos de seu encarte correspondente foram feitas por William, com a primeira recebendo análises prezando sua estranheza.|sample-1293.wav
 O acordo de paz final aceitando as reivindicações do Brasil foi assinado em janeiro de mil oitocentos e sessenta e dois.|sample-1294.wav
Novas obras apareciam em um ritmo regular, e em algumas das principais peças de vulto desta fase inicial, como a Sinfonia Fúnebre, que lhe trouxe significativa fama e consolidou seu prestígio como compositor, já daria sinais de possuir uma voz própria.|sample-1296.wav
Esperava companheirismo verdadeiro, pois, para além disso, a vida não tinha mais nada para me oferecer.|sample-1297.wav
 Outros têm como alvo as células estaminais cancerígenas extremamente resistentes.|sample-1300.wav
 Um gabinete poderia ganhar o apoio de chefes locais para candidatos nacionais usando apenas o clientelismo.|sample-1301.wav
 Sendo o estigma um sinal do contato com Deus, Grant acreditou que esta tomada retratou uma reciprocidade entre o adorador e o divino.|sample-1302.wav
 O trem de pouso dianteiro será fabricado pela empresa suíça Group.|sample-1303.wav
 A situação se complicou com a ocorrência de diversas pragas agrícolas, prejudicando a produção de meios de subsistência básicos e provocando períodos de fome, quando não eram as epidemias e os ataques de tribos selvagens que dizimavam ou afugentavam a população de núcleos já consolidados.|sample-1304.wav
 Volumes gigantescos de lavas acabaram sendo injetados e extravasados em toda a Bacia do Paraná, cobrindo todo o deserto Botucatu em dezenas de derrames.|sample-1305.wav
 Em relação ao doping, ele enfatizou que o Brasil respeita as regras da Agência Mundial Antidoping e que sempre investiga casos suspeitos.|sample-1308.wav
 Em teoria, suas iniciativas para reformas judiciais e eleitorais garantiriam eleições mais justas, já que tentavam reduzir a influência corruptora dos partidos políticos.|sample-1310.wav
 Ele acaba por perder a batalha para Devon, que lhe despede do seu atual trabalho, o que faz com que ele vá trabalhar na política.|sample-1311.wav
 Watson e seu irmão passavam os finais de semana na casa do pai, em Londres.|sample-1312.wav
 A barragem também acabou por privar os fazendeiros das enchentes anuais que ajudavam a fertilizar as suas plantações.|sample-1313.wav
A aparência e evolução dos navios de guerra medievais é tema de debates e conjeturas até recentemente, não se tinha descoberto quaisquer restos de navios de guerra a remos da Alta Idade Média, e as informações tinham que ser obtidas através da análise de fontes literárias, representações artísticas grosseiras e restos de alguns navios mercantes.|sample-1315.wav
 Nenhum romance brasileiro, acho, tem sido reinterpretado de uma maneira tão totalizadora.|sample-1316.wav
 As atividades ocorrem durante o ano inteiro.|sample-1317.wav
 Ele modera o clima da Terra e desempenha importante papel nos ciclos hídrico, do carbono e do nitrogênio.|sample-1318.wav
 Suas linhas, quando curvas, seguem um arco bem definido e quando retas, possuem a precisão de uma régua.|sample-1319.wav
 Pedro, não teve direito a figurar com tal destaque, embora seja referido ao longo da Crónica, em especial quando se negociava o seu casamento com a princesa.|sample-1322.wav
 Os Aliados, no entanto, impediram a invasão ao interceptar e derrotar as forças navais japonesas na Batalha do Mar de Coral.|sample-1323.wav
 Entre outros fatores, a produção de fruta e o comportamento animal variam consoante o local e a época, o que pode desencadear surtos ocasionais entre as populações animais quando se reúnem as condições propícias.|sample-1324.wav
 Canadá, China, México, Japão e Alemanha são os seus principais parceiros comerciais.|sample-1325.wav
 Em um comunicado posterior, seriam listadas as corporações que foram alvos em potenciais, bem como os motivos destes atos considerados pelos manifestantes como crimes corporativos.|sample-1326.wav
 Voltando a Florença, esculpiu um São Tiago  para a Catedral, e um Baco.|sample-1327.wav
 Em decorrência disso, pouco tempo depois, seu conceito fora quase totalmente esquecido  permanecendo no programa das escolas militares e estagnando como condicionamento físico, devido ao fechamento de muitas instituições.|sample-1328.wav
 Em dois mil e nove ocorreram cento e sessenta e um acidentes no trânsito local com vítimas fatais e mil duzentos e sessenta e oito  atropelamentos.|sample-1329.wav
 Posteriormente, na mesma rede social, a troca de mensagens entre as duas artistas causou especulação sobre a gravação do trabalho.|sample-1330.wav
 Havia umas duas canções boas e uma pilha monumental de lixo.|sample-1333.wav
 Estes solos apresentam excelentes propriedades físicas são friáveis, bem estruturados, com boa drenagem e capacidade de retenção de água moderada.|sample-1334.wav
 Durante a segunda metade da década de mil, novecentos e noventa, o grunge foi suplantado pelo post grunge, que permaneceu viável comercialmente no início do século vinte.|sample-1335.wav
 Londres é um dos três centros de comando da economia global e é o maior centro financeiro do mundo ao lado de Nova Iorque, e possui o maior PIB urbano da Europa.|sample-1336.wav
